{
  "kind": "character_binding",
  "contractVersion": "2.0.0",
  "bindingId": "binding.char-shot-12-shen",
  "characterSpecRef": {
    "characterId": "char.shen-yanqiu",
    "version": 1,
    "contentHash": "sha256:bbbbbbbbbbbbbbbbbbbbbbbbbbbbbbbbbbbbbbbbbbbbbbbbbbbbbbbbbbbbbbbb"
  },
  "roleInShot": "primary",
  "activeAnchorIds": [
    "face.shape",
    "eyes.horizontal",
    "mouth.asymmetry",
    "body.silhouette"
  ],
  "performanceState": {
    "stateId": "threatened",
    "emotion": "恐惧",
    "intensity": 0.38,
    "concealment": 0.82,
    "objective": "保护身后的孩子且不暴露自己的恐惧。",
    "obstacle": "狭窄走廊、持械追兵和被切断的退路。"
  },
  "actionArc": {
    "startState": "眼睛先锁定追兵双手，身体尚未后撤。",
    "trigger": "追兵抬起武器。",
    "peakState": "左脚后撤半步，身体移动到孩子与危险之间。",
    "endState": "右手靠近剑柄但仍未拔剑，重心稳定。"
  },
  "observablePerformance": {
    "posture": "上半身保持直立，重心降低，左脚后撤半步。",
    "gaze": "始终先观察对方手部，再确认出口。",
    "face": "下眼睑收紧、下颌轻微绷紧，不夸张睁眼。",
    "hands": "右手靠近剑柄，左手保持在孩子前方。",
    "breath": "动作触发前短暂停顿，随后恢复低幅度呼吸。",
    "voice": "音量不提高，语速略微变慢。"
  },
  "referenceObservationIds": [
    "OBS_FACE_FRONT_01",
    "OBS_BODY_NEUTRAL_01",
    "OBS_POSE_THREATENED_01"
  ],
  "preserve": [
    "四个当前可见身份锚点",
    "右手惯用侧",
    "受控动作幅度基线"
  ],
  "allowedDeviations": [
    "发丝被走廊气流轻微扰动",
    "衣摆因后撤动作产生有限拖曳"
  ],
  "forbiddenChanges": [
    "不得改变脸部几何",
    "不得改变头身比和肩胯关系",
    "不得把恐惧演成夸张后仰"
  ],
  "appearanceStateRef": {
    "appearanceStateId": "appearance.shen-duty",
    "version": 1,
    "contentHash": "sha256:cccccccccccccccccccccccccccccccccccccccccccccccccccccccccccccccc"
  },
  "behaviorLogic": {
    "perception": "追兵抬起武器，同时退路被封锁。",
    "appraisal": "直接拔剑会立即升级冲突，但不移动会让孩子暴露。",
    "chosenStrategy": "先用身体建立保护位并观察对方手部，保留反击选择。",
    "suppressedImpulse": "压下立即攻击和后退逃离的冲动。",
    "actionReason": "左脚后撤和右手近剑柄同时实现保护、稳定与威慑。"
  },
  "emotionControl": {
    "primary": "恐惧",
    "secondary": "保护欲",
    "intensity": 0.38,
    "concealment": 0.82,
    "valence": -0.55,
    "arousal": 0.62,
    "dominance": 0.68,
    "trajectory": "警觉上升，在动作终点转化为受控决心。",
    "leakageChannels": [
      "脚尖与重心",
      "下眼睑",
      "下颌",
      "呼吸停顿"
    ]
  },
  "microExpression": {
    "eyes": "下眼睑略收紧，眨眼频率降低。",
    "brows": "眉间张力轻微增加但不明显抬眉。",
    "mouth": "嘴角保持基线，唇部轻微压紧。",
    "jaw": "下颌短暂绷紧。",
    "timing": "目光先变化，约半拍后下颌和手部动作出现。"
  },
  "environmentResponse": [
    "西南至东北的弱风只影响碎发和衣摆",
    "冷侧光从人物左前方进入，白玉反射提供低强度填充"
  ]
}
